<?xml version="1.0"?>
<!DOCTYPE note SYSTEM "note.dtd">
<note>
  <to>Tove</to>
  <from>
      <email>email@gmail.com</email>
      <nombre>Pablo</nombre>
  </from>
  <heading>Reminder</heading>
  <body>
      <mensaje>hola</mensaje>
      <fecha>
          <dia>1</dia>
          <mes>enero</mes>
          <ano>2000</ano>
      </fecha>
  </body>
</note> 